,Unnamed: 0,@type,name,offers.@type,offers.price,offers.priceCurrency,type_of_plate,rating,cuisine,direction,geo,restaurant
0,0,MenuItem,"Ensaladilla rusa de marisco, salsa americana y pan carasatu",Offer,11.0,EUR,ENTRANTES FRIOS Y ENSALADAS,9.2,"""Mediterráneo""","""Calle López de Aranda","""geo"":{""latitude"":40.4440393,""longitude"":-3.6340386",Aranda Madrid
1,1,MenuItem,"Hummus de berenjena asada, aceite de albahaca y pipas de calabaza tostadas",Offer,11.0,EUR,ENTRANTES FRIOS Y ENSALADAS,9.2,"""Mediterráneo""","""Calle López de Aranda","""geo"":{""latitude"":40.4440393,""longitude"":-3.6340386",Aranda Madrid
2,2,MenuItem,"Ensalada templada de perdiz escabechada con mojo rojo, cebolla asada y frambuesa liofilizada",Offer,16.5,EUR,ENTRANTES FRIOS Y ENSALADAS,9.2,"""Mediterráneo""","""Calle López de Aranda","""geo"":{""latitude"":40.4440393,""longitude"":-3.6340386",Aranda Madrid
3,3,MenuItem,"Ensalada thai de langostinos crunchy, nearness de chile ahumado y maíz",Offer,14.5,EUR,ENTRANTES FRIOS Y ENSALADAS,9.2,"""Mediterráneo""","""Calle López de Aranda","""geo"":{""latitude"":40.4440393,""longitude"":-3.6340386",Aranda Madrid
4,4,MenuItem,Tiradito de lubina nikkei con vieras gratinadas y mahonesa de harissa,Offer,16.0,EUR,ENTRANTES FRIOS Y ENSALADAS,9.2,"""Mediterráneo""","""Calle López de Aranda","""geo"":{""latitude"":40.4440393,""longitude"":-3.6340386",Aranda Madrid
5,5,MenuItem,Tabla de quesos internacionales artesanos,Offer,14.0,EUR,ENTRANTES FRIOS Y ENSALADAS,9.2,"""Mediterráneo""","""Calle López de Aranda","""geo"":{""latitude"":40.4440393,""longitude"":-3.6340386",Aranda Madrid
6,6,MenuItem,Lomito ibérico de bellota Castro Gonzalez y pan de coca,Offer,18.0,EUR,ENTRANTES FRIOS Y ENSALADAS,9.2,"""Mediterráneo""","""Calle López de Aranda","""geo"":{""latitude"":40.4440393,""longitude"":-3.6340386",Aranda Madrid
