,Unnamed: 0,@type,name,offers.@type,offers.price,offers.priceCurrency,type_of_plate,rating,cuisine,direction,geo,restaurant
0,0,MenuItem,"Rollito de salmón relleno de queso cremoso y puerros, sobre cama de lechuga mezclum con frutos del bosque, aliñado con vinagreta balsámico",Offer,9,EUR,Ensaladas,8.9,"""Crepería""","""Av","""geo"":{""latitude"":40.4521355,""longitude"":-3.6677114",Banan banan creps
1,1,MenuItem,"Ensalada de quinoa con tiras de verduras salteadas y tomate seco, aliñado con salsa pesto",Offer,9,EUR,Ensaladas,8.9,"""Crepería""","""Av","""geo"":{""latitude"":40.4521355,""longitude"":-3.6677114",Banan banan creps
2,2,MenuItem,Aguacate relleno de ensaladilla rusa,Offer,9,EUR,Ensaladas,8.9,"""Crepería""","""Av","""geo"":{""latitude"":40.4521355,""longitude"":-3.6677114",Banan banan creps
3,3,MenuItem,"Ensalada de espinacas, queso feta y manzana, acompañado de arándanos rojos secos",Offer,9,EUR,Ensaladas,8.9,"""Crepería""","""Av","""geo"":{""latitude"":40.4521355,""longitude"":-3.6677114",Banan banan creps
4,4,MenuItem,Croquetas de gambas al ajillo,Offer,6,EUR,Ensaladas,8.9,"""Crepería""","""Av","""geo"":{""latitude"":40.4521355,""longitude"":-3.6677114",Banan banan creps
