,Unnamed: 0,@type,name,offers.@type,offers.price,offers.priceCurrency,type_of_plate,rating,cuisine,direction,geo,restaurant
0,0,MenuItem,Croqueta de sepia y gamba en tempura con alioli de ajo negro,Offer,2.45,EUR,Para compartir... Empieza picando,8.7,None,"""Calle del Barquillo","""geo"":{""latitude"":40.4202225,""longitude"":-3.6954273",Skull St. Food
1,1,MenuItem,Nem de pato lacado con salsa hoisin y hierbas aromáticas,Offer,4.45,EUR,Para compartir... Empieza picando,8.7,None,"""Calle del Barquillo","""geo"":{""latitude"":40.4202225,""longitude"":-3.6954273",Skull St. Food
2,2,MenuItem,Patatas bravas... Bravas... Bravas,Offer,8.0,EUR,Para compartir... Empieza picando,8.7,None,"""Calle del Barquillo","""geo"":{""latitude"":40.4202225,""longitude"":-3.6954273",Skull St. Food
3,3,MenuItem,Bocata de calamarcitos con mayonesa de lima,Offer,8.0,EUR,Para compartir... Empieza picando,8.7,None,"""Calle del Barquillo","""geo"":{""latitude"":40.4202225,""longitude"":-3.6954273",Skull St. Food
4,4,MenuItem,Hummus de berenjena al carbón con chips de batata y yuca,Offer,8.0,EUR,Para compartir... Empieza picando,8.7,None,"""Calle del Barquillo","""geo"":{""latitude"":40.4202225,""longitude"":-3.6954273",Skull St. Food
5,5,MenuItem,Ensalada skull con polvo de mojama,Offer,8.45,EUR,Para compartir... Empieza picando,8.7,None,"""Calle del Barquillo","""geo"":{""latitude"":40.4202225,""longitude"":-3.6954273",Skull St. Food
