,Unnamed: 0,@type,name,offers.@type,offers.price,offers.priceCurrency,type_of_plate,rating,cuisine,direction,geo,restaurant
0,0,MenuItem,Selección de quesos de Abel Valverde (entre 4 referencias),Offer,15.9,EUR,Entrante,9.1,"""Español""","""Paseo del Prado","""geo"":{""latitude"":40.4097889,""longitude"":-3.6928323",Tablafina - NH Nacional
1,1,MenuItem,Ensaladilla de atún en corteza de trigo,Offer,7.9,EUR,Entrante,9.1,"""Español""","""Paseo del Prado","""geo"":{""latitude"":40.4097889,""longitude"":-3.6928323",Tablafina - NH Nacional
2,2,MenuItem,"Croquetas de jamón ibérico, cocido, bacalao o de pollo de corral",Offer,5.9,EUR,Entrante,9.1,"""Español""","""Paseo del Prado","""geo"":{""latitude"":40.4097889,""longitude"":-3.6928323",Tablafina - NH Nacional
3,3,MenuItem,Lasaña de Rabo de Ternera y Setas,Offer,7.9,EUR,Entrante,9.1,"""Español""","""Paseo del Prado","""geo"":{""latitude"":40.4097889,""longitude"":-3.6928323",Tablafina - NH Nacional
4,4,MenuItem,Tosta de Bacalao y Aguacate,Offer,5.9,EUR,Entrante,9.1,"""Español""","""Paseo del Prado","""geo"":{""latitude"":40.4097889,""longitude"":-3.6928323",Tablafina - NH Nacional
5,5,MenuItem,Ensalada de quinoa con langostino y mango,Offer,9.9,EUR,Entrante,9.1,"""Español""","""Paseo del Prado","""geo"":{""latitude"":40.4097889,""longitude"":-3.6928323",Tablafina - NH Nacional
