,Unnamed: 0,@type,name,offers.@type,offers.price,offers.priceCurrency,type_of_plate,rating,cuisine,direction,geo,restaurant
0,0,MenuItem,Mousse de chocolate negro y yuzu con salsa de sorbete de mandarina,Offer,8.5,EUR,Postre,9.6,"""Japonés""","""Paseo de la Castellana","""geo"":{""latitude"":40.4357019,""longitude"":-3.6896704",Miyama Castellana
1,1,MenuItem,Harumaki De Chocolate Con Helado De Vainilla,Offer,6.0,EUR,Postre,9.6,"""Japonés""","""Paseo de la Castellana","""geo"":{""latitude"":40.4357019,""longitude"":-3.6896704",Miyama Castellana
2,2,MenuItem,Tarta De Manzana Caramelizada Con Helado De Nuez y Miel,Offer,8.5,EUR,Postre,9.6,"""Japonés""","""Paseo de la Castellana","""geo"":{""latitude"":40.4357019,""longitude"":-3.6896704",Miyama Castellana
3,3,MenuItem,Mochi con Bizcocho De Té Verde y Sorbete De Fresa,Offer,8.0,EUR,Postre,9.6,"""Japonés""","""Paseo de la Castellana","""geo"":{""latitude"":40.4357019,""longitude"":-3.6896704",Miyama Castellana
4,4,MenuItem,Sorbete De Lichi Con Crema De Chocolate Blanco y Perlas De Rosas,Offer,8.5,EUR,Postre,9.6,"""Japonés""","""Paseo de la Castellana","""geo"":{""latitude"":40.4357019,""longitude"":-3.6896704",Miyama Castellana
5,5,MenuItem,Helado De Cerveza Japonesa y Salsa De Mango Con Cacahuete,Offer,8.0,EUR,Postre,9.6,"""Japonés""","""Paseo de la Castellana","""geo"":{""latitude"":40.4357019,""longitude"":-3.6896704",Miyama Castellana
6,6,MenuItem,Chawanmushi De Crema Quemada con Azuki,Offer,6.0,EUR,Postre,9.6,"""Japonés""","""Paseo de la Castellana","""geo"":{""latitude"":40.4357019,""longitude"":-3.6896704",Miyama Castellana
7,7,MenuItem,Helado O Sorbete Del Día,Offer,4.0,EUR,Postre,9.6,"""Japonés""","""Paseo de la Castellana","""geo"":{""latitude"":40.4357019,""longitude"":-3.6896704",Miyama Castellana
