,Unnamed: 0,@type,name,offers.@type,offers.price,offers.priceCurrency,type_of_plate,rating,cuisine,direction,geo,restaurant
0,0,MenuItem,Antxoas en Salazón con Pan y Tomate,Offer,21,EUR,Variantes y Ultramarinos,9.1,"""Vasco""","""Calle del Aviador Zorita","""geo"":{""latitude"":40.4474649,""longitude"":-3.6987246",Asador Guetaria
1,1,MenuItem,Pastel Templado de Centollo y Buey de Mar,Offer,19,EUR,Variantes y Ultramarinos,9.1,"""Vasco""","""Calle del Aviador Zorita","""geo"":{""latitude"":40.4474649,""longitude"":-3.6987246",Asador Guetaria
2,2,MenuItem,Jamón y Lomo Ibérico con Pan y Tomate,Offer,31,EUR,Variantes y Ultramarinos,9.1,"""Vasco""","""Calle del Aviador Zorita","""geo"":{""latitude"":40.4474649,""longitude"":-3.6987246",Asador Guetaria
3,3,MenuItem,Cecina Premium con Aceite y Queso Fresco,Offer,22,EUR,Variantes y Ultramarinos,9.1,"""Vasco""","""Calle del Aviador Zorita","""geo"":{""latitude"":40.4474649,""longitude"":-3.6987246",Asador Guetaria
4,4,MenuItem,Pimientos Rellenos de Marisco con Salsa de Nécoras,Offer,21,EUR,Variantes y Ultramarinos,9.1,"""Vasco""","""Calle del Aviador Zorita","""geo"":{""latitude"":40.4474649,""longitude"":-3.6987246",Asador Guetaria
5,5,MenuItem,Arroz Cremoso de Setas y Hongos Trufados,Offer,21,EUR,Variantes y Ultramarinos,9.1,"""Vasco""","""Calle del Aviador Zorita","""geo"":{""latitude"":40.4474649,""longitude"":-3.6987246",Asador Guetaria
