,Unnamed: 0,@type,name,offers.@type,offers.price,offers.priceCurrency,type_of_plate,rating,cuisine,direction,geo,restaurant
0,0,MenuItem,"Atún Madness: atún rojo , salsa shoyu ponzu, aguacate, pepino, algas hijiki, tobiko, pepino y jalapeños encurtidos",Offer,13,EUR,Pokes de autor,8.8,None,"""Calle de Núñez de Balboa","""geo"":{""latitude"":40.4253873,""longitude"":-3.6829026",Pokelolo
1,1,MenuItem,"Dorada Superfresh: Dorada, salsa de jengibre, encurtido, daikon, aguacate, crunchy de furikake de arroz",Offer,12,EUR,Pokes de autor,8.8,None,"""Calle de Núñez de Balboa","""geo"":{""latitude"":40.4253873,""longitude"":-3.6829026",Pokelolo
2,2,MenuItem,"Salmón Boom: salmón, salsa cremosa de siracha y schichimi, edamame , aguacate, lombarda encurtida, berro , cebolla frita y rabanito",Offer,13,EUR,Pokes de autor,8.8,None,"""Calle de Núñez de Balboa","""geo"":{""latitude"":40.4253873,""longitude"":-3.6829026",Pokelolo
3,3,MenuItem,"Tiger Dorada: Dorada, leche de tigre, maíz tostado, maduritos, guindilla roja, ají amarillo, guacamole, cebolla morada, edamame y cebolla china",Offer,12,EUR,Pokes de autor,8.8,None,"""Calle de Núñez de Balboa","""geo"":{""latitude"":40.4253873,""longitude"":-3.6829026",Pokelolo
4,4,MenuItem,"Zamburiña Hype : Zamburiñas flambeadas , salsa kimchi picante, naranjas valencianas, guisantes,daikon, kale crujiente, y kimchi encurtido",Offer,15,EUR,Pokes de autor,8.8,None,"""Calle de Núñez de Balboa","""geo"":{""latitude"":40.4253873,""longitude"":-3.6829026",Pokelolo
5,5,MenuItem,"Veggie Mood: salsa shoyu picante, tofu flambeado y marinado en salsa BBQ coreana, edamame, zanahoria, rabanitos, aguacate, pepino, remolacha encurtida, alga nori y kale crujiente",Offer,9,EUR,Pokes de autor,8.8,None,"""Calle de Núñez de Balboa","""geo"":{""latitude"":40.4253873,""longitude"":-3.6829026",Pokelolo
6,6,MenuItem,"Salmón grill: Salmón Flambeado con salsa BBQ koreana, salsa de jengibre encurtido, aguacate, pepino encurtido, alga hijiki, mayo wasabi, tobiko y cebolleta",Offer,14,EUR,Pokes de autor,8.8,None,"""Calle de Núñez de Balboa","""geo"":{""latitude"":40.4253873,""longitude"":-3.6829026",Pokelolo
