,Unnamed: 0,@type,name,offers.@type,offers.price,offers.priceCurrency,type_of_plate,rating,cuisine,direction,geo,restaurant
0,0,MenuItem,Tartar de atún rojo con guacamole y salsa de soja con hojas de lima,Offer,24,EUR,Pescados,9,"""Creativo""","""Calle de Diego de León","""geo"":{""latitude"":40.434877,""longitude"":-3.6789438",Haroma por Mario Sandoval...
1,1,MenuItem,Parpatana de atún glaseado con guiso de tomate de árbol y semilla de maracuyá,Offer,26,EUR,Pescados,9,"""Creativo""","""Calle de Diego de León","""geo"":{""latitude"":40.434877,""longitude"":-3.6789438",Haroma por Mario Sandoval...
2,2,MenuItem,Lubina al horno con pimientos de cristal confitados tomate rosa y chips de ajo,Offer,24,EUR,Pescados,9,"""Creativo""","""Calle de Diego de León","""geo"":{""latitude"":40.434877,""longitude"":-3.6789438",Haroma por Mario Sandoval...
3,3,MenuItem,"Bacalao al pil pil de ají amarillo, gamba con cristal crujiente y jalapeños",Offer,23,EUR,Pescados,9,"""Creativo""","""Calle de Diego de León","""geo"":{""latitude"":40.434877,""longitude"":-3.6789438",Haroma por Mario Sandoval...
4,4,MenuItem,Besugo en escabeche al oloroso y berenjena con ajo morado de las pedroñeras,Offer,24,EUR,Pescados,9,"""Creativo""","""Calle de Diego de León","""geo"":{""latitude"":40.434877,""longitude"":-3.6789438",Haroma por Mario Sandoval...
