,Unnamed: 0,@type,name,offers.@type,offers.price,offers.priceCurrency,type_of_plate,rating,cuisine,direction,geo,restaurant
0,0,MenuItem,"Al estilo Ottolenghi: Ensalada de lentejas al curry con calabaza y naranja asadas, hierbas aromáticas y queso feta",Offer,14,EUR,DEL PROGRAMA,8.9,"""Creativo""","""Calle de Velázquez","""geo"":{""latitude"":40.4431511,""longitude"":-3.6823055",MasterChef
1,1,MenuItem,De Andrea Tumbarello: Pasta tagliolini al tartufo rallada al momento,Offer,26,EUR,DEL PROGRAMA,8.9,"""Creativo""","""Calle de Velázquez","""geo"":{""latitude"":40.4431511,""longitude"":-3.6823055",MasterChef
2,2,MenuItem,De Josetxo: Nuggets de pollo marinado y rebozado en panko con 3 salsas,Offer,14,EUR,DEL PROGRAMA,8.9,"""Creativo""","""Calle de Velázquez","""geo"":{""latitude"":40.4431511,""longitude"":-3.6823055",MasterChef
3,3,MenuItem,Al estilo de Pepe: Cochinillo de Pepe Rodriguez con puré de castañas y tamarindo,Offer,26,EUR,DEL PROGRAMA,8.9,"""Creativo""","""Calle de Velázquez","""geo"":{""latitude"":40.4431511,""longitude"":-3.6823055",MasterChef
4,4,MenuItem,De Silvia Abril: Solomillo con salsa de mostaza antigua y setas de temporada,Offer,25,EUR,DEL PROGRAMA,8.9,"""Creativo""","""Calle de Velázquez","""geo"":{""latitude"":40.4431511,""longitude"":-3.6823055",MasterChef
5,5,MenuItem,Al estilo de Boris: Magret de pato con milhojas y parmentier de patata con chutney de ciruelas,Offer,24,EUR,DEL PROGRAMA,8.9,"""Creativo""","""Calle de Velázquez","""geo"":{""latitude"":40.4431511,""longitude"":-3.6823055",MasterChef
6,6,MenuItem,"De Natalia: Lubina con puré de zanahoria y picada de tomates secos, albahaca y almendras",Offer,23,EUR,DEL PROGRAMA,8.9,"""Creativo""","""Calle de Velázquez","""geo"":{""latitude"":40.4431511,""longitude"":-3.6823055",MasterChef
