,Unnamed: 0,@type,name,offers.@type,offers.price,offers.priceCurrency,type_of_plate,rating,cuisine,direction,geo,restaurant
0,0,MenuItem,"Pizza 1 (Tomate San Marzano BIO, mozzarella de Búfala Campana D.O.P., aceite de oliva virgen extra y albahaca fresca",Offer,9.5,EUR,Pizzas,9.3,"""Italiano""","""Calle de Embajadores","""geo"":{""latitude"":40.4090723,""longitude"":-3.7056485",Éccolo
1,1,MenuItem,"Pizza 3 (Fiordilatte dei Monti di Agerola. calabaza asada, queso de cabra, guanciale y aceite de trufa)",Offer,13.5,EUR,Pizzas,9.3,"""Italiano""","""Calle de Embajadores","""geo"":{""latitude"":40.4090723,""longitude"":-3.7056485",Éccolo
2,2,MenuItem,"Pizza 5 (Tomate San Marzano BIO, Fiordilatte dei Monti di Agerola D.O.P., jamón curado San Daniele D.O.P., rúcula fresca, tomate picado BIO y escamas de Parmigiano Reggiano",Offer,12.5,EUR,Pizzas,9.3,"""Italiano""","""Calle de Embajadores","""geo"":{""latitude"":40.4090723,""longitude"":-3.7056485",Éccolo
3,3,MenuItem,"Pizza 9 (Tomate San Marzano BIO, Fiordilatte dei Monti di Agerola, ternera asada a baja temperatura y salsa barbacoa)",Offer,12.0,EUR,Pizzas,9.3,"""Italiano""","""Calle de Embajadores","""geo"":{""latitude"":40.4090723,""longitude"":-3.7056485",Éccolo
4,4,MenuItem,"Pizza 10 (Tomate San Marzano BIO, gorgonzola, berenjena y jamón cocido)",Offer,10.5,EUR,Pizzas,9.3,"""Italiano""","""Calle de Embajadores","""geo"":{""latitude"":40.4090723,""longitude"":-3.7056485",Éccolo
