,Unnamed: 0,@type,name,offers.@type,offers.price,offers.priceCurrency,type_of_plate,rating,cuisine,direction,geo,restaurant
0,0,MenuItem,"Ensalada de Horta (tres lechugas, tomate fresco y cebolla roja)",Offer,9.75,EUR,El verde pasto,8.8,"""Gallego""","""C","""geo"":{""latitude"":40.422075264701,""longitude"":-3.6857199668884",La Pulpería de Mila
1,1,MenuItem,Pimientos de Padrón-Herbón,Offer,9.9,EUR,El verde pasto,8.8,"""Gallego""","""C","""geo"":{""latitude"":40.422075264701,""longitude"":-3.6857199668884",La Pulpería de Mila
2,2,MenuItem,Ensaladilla rusa de bonito del norte,Offer,13.5,EUR,El verde pasto,8.8,"""Gallego""","""C","""geo"":{""latitude"":40.422075264701,""longitude"":-3.6857199668884",La Pulpería de Mila
3,3,MenuItem,"Ensalada de bonito de campaña, cebolleta dulce y tomate de temporada.",Offer,16.5,EUR,El verde pasto,8.8,"""Gallego""","""C","""geo"":{""latitude"":40.422075264701,""longitude"":-3.6857199668884",La Pulpería de Mila
4,4,MenuItem,"Verduras de la huerta braseadas (Acompañada de salsa de ñoras, nueces y tomates maduros)",Offer,14.75,EUR,El verde pasto,8.8,"""Gallego""","""C","""geo"":{""latitude"":40.422075264701,""longitude"":-3.6857199668884",La Pulpería de Mila
5,5,MenuItem,Alcachofas naturales a la parrilla con cristal de sal (En Temporada),Offer,16.0,EUR,El verde pasto,8.8,"""Gallego""","""C","""geo"":{""latitude"":40.422075264701,""longitude"":-3.6857199668884",La Pulpería de Mila
