,Unnamed: 0,@type,name,offers.@type,offers.price,offers.priceCurrency,type_of_plate,rating,cuisine,direction,geo,restaurant
0,0,MenuItem,Chipirones a la plancha encebollados,Offer,12.5,EUR,Pescados,9,"""Español""","""Av de la Victoria","""geo"":{""latitude"":40.4718148,""longitude"":-3.8286803",El Descanso 1927
1,1,MenuItem,Merluza a la gallega / Plancha / Romana,Offer,14.9,EUR,Pescados,9,"""Español""","""Av de la Victoria","""geo"":{""latitude"":40.4718148,""longitude"":-3.8286803",El Descanso 1927
2,2,MenuItem,Bacalao confitado a la vizcaína de cebolletas y pimientos,Offer,13.9,EUR,Pescados,9,"""Español""","""Av de la Victoria","""geo"":{""latitude"":40.4718148,""longitude"":-3.8286803",El Descanso 1927
3,3,MenuItem,Mero a la plancha con salteado de gulas y patatas naturales,Offer,14.9,EUR,Pescados,9,"""Español""","""Av de la Victoria","""geo"":{""latitude"":40.4718148,""longitude"":-3.8286803",El Descanso 1927
4,4,MenuItem,Carpaccio de atún rojo,Offer,12.9,EUR,Pescados,9,"""Español""","""Av de la Victoria","""geo"":{""latitude"":40.4718148,""longitude"":-3.8286803",El Descanso 1927
5,5,MenuItem,Lomo de atún rojo a la plancha,Offer,16.9,EUR,Pescados,9,"""Español""","""Av de la Victoria","""geo"":{""latitude"":40.4718148,""longitude"":-3.8286803",El Descanso 1927
6,6,MenuItem,Lomo de atún rojo fileteado 500 grs.(para compartir),Offer,33.8,EUR,Pescados,9,"""Español""","""Av de la Victoria","""geo"":{""latitude"":40.4718148,""longitude"":-3.8286803",El Descanso 1927
